{
  "schema": "allset/intent/v1",
  "kind": "revoke",
  "chain": "eip155:5042",
  "bridge": "0x8677edaa374b7a47ff0093947aabe4acbb2d4538",
  "transfer_tx": "0x1111111111111111111111111111111111111111111111111111111111111111",
  "deadline": "1789071600",
  "intents": [
    {
      "action": "revoke",
      "value": "0"
    }
  ]
}