{
  "schema": "allset/intent/v1",
  "kind": "execute",
  "chain": "eip155:5042",
  "bridge": "0x8677edaa374b7a47ff0093947aabe4acbb2d4538",
  "transfer_tx": "0x3333333333333333333333333333333333333333333333333333333333333333",
  "deadline": "1789071600",
  "intents": [
    {
      "action": "execute",
      "target": "0x3600000000000000000000000000000000000000",
      "calldata": "0x",
      "value": "1000"
    }
  ]
}